" According to Aquinas, the first precept of natural law is","""good is to be done, evil to be avoided.""","""one ought to do what one will.""","""one ought to do only what can be done without contradiction.""","""pleasure is to be sought, pain to be avoided.""",A
" According to Singer, the conclusions argued for in ""all animals are equal"" flow from which of the following principles alone?",the principle of maximizing happiness,the principal principle,the principle of double effect,the principle of minimizing suffering,D
" In his discussion of discrimination in war, Valls suggests that",there is no difference between combatants and noncombatants.,the difference between combatants and noncombatants is a matter of degree.,the difference between combatants and noncombatants is categorical and clear.,"""terrorism"" should be defined as indiscriminate violence.",B
 What information is available to occupants within Rawls's original position?,knowledge of how one is talented compared to others,knowledge of one's social status,"knowledge of one's abilities, such as intelligence, strength, and so on",none of the above,D
" Mary's laptop deserves moral consideration only because she owns it and cares about it. Thus, Mary's laptop has",direct moral standing.,indirect moral standing.,relative moral standing.,inherent or intrinsic worth.,B
 Van den Haag is,a distributionist.,an abolitionist.,a retentionist.,a humanitarian.,C
" Kant's Universal Law formulation does not refer to an agent's wants; rather, it represents",an ethical dilemma.,a criterion for social acceptability.,a way to measure the value of an action's consequences.,a kind of consistency test.,D
 West argues that feminist rhetoric has,"obscures the harms of noncoerced, consensual sex by implying that because what is coerced is bad what is noncoerced is good.",obscures the harms of rape by equating all sex with nonconsensual sex.,"by not acknowledging a distinction between what is good and what noncoerced, has led to the acknowledgement of the harms of consensual sex.",All of the above,A
 Some forms of misogynist speech only target a subset of women. Richardson-Self argues that we should,deny that subsets of women can be the targets of hate speech.,say that this speech is merely sexist speech.,consider such speech hate speech.,understand misogynistic speech as akin to other forms of oppressive speech against racial minorities.,C
 Mill argues on that even a false opinion should not be censored because,no one actually knows anything.,you don't really know the true view unless you can explain why false views are false.,you don't really know whether or not anything is false.,All of the above.,B
" According to Carruthers, which of the following groups should not be accorded direct moral standing?",human infants,the senile,the mentally disabled,none of the above,D
 Kass worries that cloned individuals:,will be seen as curiosities.,will be scrutinized in relation to the person they are clones of.,both of the above,none of the above,C
" In his objection to ""the second prong of the libertarian case for open borders,"" Wellman responds to the objection that he is essentially denying that we have a right to freedom of movement. Which of the following is part of his response?",He would say this begs the question because the immigration question is identical to the freedom-of-movement question.,He would present an argument showing that there is actually no right to freedom of movement.,"He would argue that some rights are not absolute (e.g., the right to marriage doesn't allow you to marry an unwilling partner).",He would use deontological premises to deductively conclude that unjust public policies are morally objectionable.,C
 Which of the following is not one of the four main excuses for terrorism that Michael Walzer discusses?,Terrorism is a form of freedom of speech.,Terrorism is a last resort.,Terrorism benefits oppressed groups.,All political activity is terroristic.,A
 Richardson-Self argues that sexist speech,"is always hate speech, because it involves violence.","is not always hate speech, because it does not involve violence","is always hate speech, because it does not involves violence.","I s not always hate speech, because it always involves violence.",B
 Which of the following statements best describes Gill's response to the argument that the Oregon physician-assisted law falsely assumes that doctors are qualified to judge whether a life is worth living?,Doctors are as qualified as any other mature adult to decide whether a life is worth living.,"Doctors are normally required to make life-and-death decisions, and this is no exception.",The argument is self-defeating because it was proposed by medical doctors.,The law only requires doctors to make medical decisions about the patient's life expectancy and prognosis.,D
" In his definition of terrorism, Valls defines ""violence"" as",including only bodily harm to persons.,including bodily harm to persons and the destruction of property.,including only the destruction of property.,none of the above,B
" Mill thinks that if something is desirable, but not desirable as an end, then it must be",desirable as a rule.,desirable in theory.,desirable as a means.,none of the above,C
" According to Carruthers, our duties to animals are",direct and basic.,indirect and derivative.,nonexistent.,perfect (rather than imperfect).,B
" According to Ross, when our duties conflict with each other we should",not do anything because duties cannot actually conflict with each other.,use moral judgment to determine which duty should be obeyed.,consult authorities instead of relying on our own judgment.,wait until the conflict ceases on its own.,B
 Lukianoff and Haidt argue that trigger warnings involve which kind of pathological thinking?,fortune-telling,blaming,dichotomous thinking,resentment,B
 Aristotle's moral theory is a version of,virtue ethics.,consequentialism.,rights-based theory.,utilitarianism.,A
 Rachels believes that active euthanasia is better than passive euthanasia in cases where,"the patient will suffer more if he or she is allowed to die, compared to how much he or she would suffer if the physician actively ended his or her life.","the patient will suffer less if he or she is allowed to die, compared to how much he or she would suffer if the physician actively ended his or her life.",the patient clearly states that he or she would prefer to live as long as possible.,none of the above,A
 Which of the following is an example of a value-based moral theory?,consequentialism,virtue ethics,both A and B,neither A nor B,C
 Hardin's approach to the moral issues of hunger and poverty is essentially,a consequentialist approach.,a virtue ethics approach.,an ethics of prime facie duty approach.,a Christian/Marxist approach.,A
" By definition, if a person or thing needs to be taken into account in moral decision-making (i.e., if it counts morally), then that person or thing has",moral standing.,moral permissibility.,viability.,all of the above,A
 One suggestion that Lukianoff and Haidt make to challenge vindictive protectiveness is,have colleges and universities officially and strongly discourage trigger warnings.,to defund the Department of Education.,to promote greater understanding of historical and contemporary oppression.,none of the above.,B
 Nathanson believes that killing another person in self-defense is compatible with,respect for the dignity of persons.,the principle of equality.,a consequentialist theory of punishment..,equality retributivism.,A
" In responding to terrorism, says Walzer, it is particularly important that",we make an effort to convince the terrorists that they are acting wrongly.,we avoid harming terrorists to the same extent that we would avoid harming innocent civilians.,we attack the lower-ranking terrorists first.,we do not repeat the wrongs of terrorism in the process.,D
 Ross's moral theory is a version of,consequentialism.,the ethics of prime facie duty.,Kantian theory.,virtue ethics.,B
 West worries that liberal theory in academia has inadvertently led to the under-acknowledgement of the harms of consensual sex because,it is implicitly sexist.,it promotes individualism and valorizes individual choice.,it is too left-wing to support a sound gender-based critique of our sex practices.,it promotes communitarian thinking to the detriment of individualism.,B
" In ethics, the terms ""right"" and ""wrong"" are used primarily to evaluate the morality of",persons.,actions.,consequences.,concrete objects.,B
 Sandel's case against moral engineering can best be considered,a Kantian approach.,an application of the ethics of prima facie duty.,a virtue ethics approach.,a natural law theory approach.,C
 Kant argues that marriage allows spouses to treat each other not as mere means when engaging in sexual activity because,God demands that all sexual activity occur in the context of marriage.,this will ultimately produce the most happiness for the greatest number of persons.,in marriage two persons equally and reciprocally transfer their whole person to the other.,the universal law formulation of the categorical imperative requires that each of us be married.,C
" Wellman cites a number of ""unpalatable implications that follow from denying a country's right to freedom of association,"" including",the inability to explain why it would be wrong to force Canada to join NAFTA.,the inability to explain why it would be wrong for the United States to forcefully annex Canada .,both A and B,neither A nor B,C
 One message that Nathanson argues we can send by abolishing the death penalty is that,we respect the dignity of human life.,there are some penalties worse than death.,there is no punishment that is proportional to murder.,none of the above,A
 Which of the following statements would Macedo disagree with?,States should give special weight to their own citizens.,Immigration policies can have powerful economic effects.,Self-governance is morally irrelevant to the immigration debate.,There are reasons to think U.S. immigration policy has had detrimental effects on income distribution among citizens.,C
 Ross argues that the existing body of moral convictions of the best people is the cumulative product of,the moral reflection of many generations.,generations of bias and self-confirmation.,ignorance.,political discourse.,A
" If the killing/letting die distinction is morally relevant, then that would show that the following distinction is also morally relevant:",killing/murder,physician/patient,active/passive euthanasia,involuntary/nonvoluntary euthanasia,C
" On West's account, women who engage in undesired sex because of actual or felt dependence on their partner may experience injury to their sense of autonomy because",they have neglected to take whatever steps would lead to their self-sustenance.,they are dominated by their partners insofar as they are not free to do as they please.,they are actually coerced into having sex.,none of the above.,A
 A war that involves actual fighting is known as,a hot war.,a cold war.,a war simpliciter.,none of the above,A
" With respect to the issue of world hunger and poverty, Arthur points out that Singer ignores",the principles of equality and harm.,the principles of the right and the good.,the principles of rights and desert.,the principles of ability to help and desires.,C
" On Metz's view, what kind of punishment is justified for wrongdoers?",Harmful punishment that is proportionate to the harm done by the wrongdoing.,"Unfriendly action that is proportionate to the unfriendly wrongdoing, aimed at correcting the wrongdoing.",Degradation proportionate to the degrading impacts of the wrongdoing.,All of the above.,B
 Why does Metz think that extant dignity-based arguments based on African values fail?,"It is unclear that they show that capital punishment is degrading, and so therefore wrong.",They prove too much. They seem to entail that any instance of killing in self-defense is wrong.,Both A and B,None of the above,C
" If it were known that a policy would wipe out several animal species without negatively affecting human beings, Baxter would most likely say that",this policy is morally problematic because it harms the environment.,this policy is morally problematic because it damages the integrity of the ecosystem.,this policy is morally obligatory because the environment ought not to exist.,this policy is morally unproblematic.,D
" In contrast to Garrett Hardin's approach, the Confucian model rejects coercion because",the costs of eliminating a collective action problem are not irrelevant to its solution,it affirms the autonomy of individuals apart from others.,"it cannot lead to real social change, which involves changes of mind as well as action",The Confucian model actually accepts coercion.,B
 All cases of euthanasia in which the patient has consented to the active bringing of his or her death are cases of,voluntary euthanasia.,involuntary euthanasia.,nonvoluntary euthanasia.,passive euthanasia.,A
 Macedo describes his position on immigration as politically,liberal.,conservative.,evangelical.,neutral.,A
 An oocyte is,an unfertilized egg.,the nucleus that is implanted into the ovum during SCNT.,the nucleus that removed from the ovum during SCNT.,an undifferentiated stem cell that can be used in treating various medical conditions.,A
 Sinnott-Armstrong is most interested in examining issues about the moral obligations of,individuals.,societies.,governments.,families.,A
 Which of the following is not an example of a natural right that Locke uses?,the right to life,the right to liberty,the right to citizenship,the right to property,C
